[
  {
    "title": "RocketNodeDistributorDelegate - Reentrancy in `distribute()` allows node owner to drain distributor funds",
    "severity": "Critical",
    "record_type": "audit_finding",
    "status": "candidate",
    "source_name": "Smart Contract VulnDB",
    "project": "/diligence/audits/2023/01/rocket-pool-atlas-v1.2/",
    "vulnerability_class": null,
    "impact": null,
    "cvss": null,
    "reward_amount": null,
    "reward_currency": null,
    "disclosed": null,
    "evidence_level": "secondary",
    "sources": [
      "https://consensys.net//diligence/audits/2023/01/rocket-pool-atlas-v1.2/"
    ],
    "notes": "Critical finding imported as metadata; review original source before promotion.",
    "case_id": "SCF-0001"
  },
  {
    "title": "didTransferShares function has no access control modifier",
    "severity": "Critical",
    "record_type": "audit_finding",
    "status": "candidate",
    "source_name": "Smart Contract VulnDB",
    "project": "/diligence/audits/2022/11/forta-delegated-staking/",
    "vulnerability_class": null,
    "impact": null,
    "cvss": null,
    "reward_amount": null,
    "reward_currency": null,
    "disclosed": null,
    "evidence_level": "secondary",
    "sources": [
      "https://consensys.net//diligence/audits/2022/11/forta-delegated-staking/"
    ],
    "notes": "Critical finding imported as metadata; review original source before promotion.",
    "case_id": "SCF-0002"
  },
  {
    "title": "The `Hypervisor.deposit` function does not check the `msg.sender`",
    "severity": "Critical",
    "record_type": "audit_finding",
    "status": "candidate",
    "source_name": "Smart Contract VulnDB",
    "project": "/diligence/audits/2022/02/gamma/",
    "vulnerability_class": null,
    "impact": null,
    "cvss": null,
    "reward_amount": null,
    "reward_currency": null,
    "disclosed": null,
    "evidence_level": "secondary",
    "sources": [
      "https://consensys.net//diligence/audits/2022/02/gamma/"
    ],
    "notes": "Critical finding imported as metadata; review original source before promotion.",
    "case_id": "SCF-0003"
  },
  {
    "title": "TransactionManager - User might steal router's locked funds",
    "severity": "Critical",
    "record_type": "audit_finding",
    "status": "candidate",
    "source_name": "Smart Contract VulnDB",
    "project": "/diligence/audits/2021/07/connext-nxtp-noncustodial-xchain-transfer-protocol/",
    "vulnerability_class": null,
    "impact": null,
    "cvss": null,
    "reward_amount": null,
    "reward_currency": null,
    "disclosed": null,
    "evidence_level": "secondary",
    "sources": [
      "https://consensys.net//diligence/audits/2021/07/connext-nxtp-noncustodial-xchain-transfer-protocol/"
    ],
    "notes": "Critical finding imported as metadata; review original source before promotion.",
    "case_id": "SCF-0004"
  },
  {
    "title": "TribalChief - A wrong `user.rewardDebt`  value is calculated during the `withdrawFromDeposit` function call",
    "severity": "Critical",
    "record_type": "audit_finding",
    "status": "candidate",
    "source_name": "Smart Contract VulnDB",
    "project": "/diligence/audits/2021/07/fei-tribechief/",
    "vulnerability_class": null,
    "impact": null,
    "cvss": null,
    "reward_amount": null,
    "reward_currency": null,
    "disclosed": null,
    "evidence_level": "secondary",
    "sources": [
      "https://consensys.net//diligence/audits/2021/07/fei-tribechief/"
    ],
    "notes": "Critical finding imported as metadata; review original source before promotion.",
    "case_id": "SCF-0005"
  },
  {
    "title": "Yearn: Re-entrancy attack during deposit",
    "severity": "Critical",
    "record_type": "audit_finding",
    "status": "candidate",
    "source_name": "Smart Contract VulnDB",
    "project": "/diligence/audits/2021/05/pooltogether-sushi-and-yearn-v2-yield-sources/",
    "vulnerability_class": null,
    "impact": null,
    "cvss": null,
    "reward_amount": null,
    "reward_currency": null,
    "disclosed": null,
    "evidence_level": "secondary",
    "sources": [
      "https://consensys.net//diligence/audits/2021/05/pooltogether-sushi-and-yearn-v2-yield-sources/"
    ],
    "notes": "Critical finding imported as metadata; review original source before promotion.",
    "case_id": "SCF-0006"
  },
  {
    "title": "zNS - Domain bid might be approved by non owner account",
    "severity": "Critical",
    "record_type": "audit_finding",
    "status": "candidate",
    "source_name": "Smart Contract VulnDB",
    "project": "/diligence/audits/2021/05/zer0-zns/",
    "vulnerability_class": null,
    "impact": null,
    "cvss": null,
    "reward_amount": null,
    "reward_currency": null,
    "disclosed": null,
    "evidence_level": "secondary",
    "sources": [
      "https://consensys.net//diligence/audits/2021/05/zer0-zns/"
    ],
    "notes": "Critical finding imported as metadata; review original source before promotion.",
    "case_id": "SCF-0007"
  },
  {
    "title": "RocketDaoNodeTrusted - DAO takeover during deployment/bootstrapping",
    "severity": "Critical",
    "record_type": "audit_finding",
    "status": "candidate",
    "source_name": "Smart Contract VulnDB",
    "project": "/diligence/audits/2021/04/rocketpool/",
    "vulnerability_class": null,
    "impact": null,
    "cvss": null,
    "reward_amount": null,
    "reward_currency": null,
    "disclosed": null,
    "evidence_level": "secondary",
    "sources": [
      "https://consensys.net//diligence/audits/2021/04/rocketpool/"
    ],
    "notes": "Critical finding imported as metadata; review original source before promotion.",
    "case_id": "SCF-0008"
  },
  {
    "title": "RocketTokenRETH - sandwiching opportunity on price updates",
    "severity": "Critical",
    "record_type": "audit_finding",
    "status": "candidate",
    "source_name": "Smart Contract VulnDB",
    "project": "/diligence/audits/2021/04/rocketpool/",
    "vulnerability_class": null,
    "impact": null,
    "cvss": null,
    "reward_amount": null,
    "reward_currency": null,
    "disclosed": null,
    "evidence_level": "secondary",
    "sources": [
      "https://consensys.net//diligence/audits/2021/04/rocketpool/"
    ],
    "notes": "Critical finding imported as metadata; review original source before promotion.",
    "case_id": "SCF-0009"
  },
  {
    "title": "RocketDaoNodeTrustedActions - Incomplete implementation of member challenge process",
    "severity": "Critical",
    "record_type": "audit_finding",
    "status": "candidate",
    "source_name": "Smart Contract VulnDB",
    "project": "/diligence/audits/2021/04/rocketpool/",
    "vulnerability_class": null,
    "impact": null,
    "cvss": null,
    "reward_amount": null,
    "reward_currency": null,
    "disclosed": null,
    "evidence_level": "secondary",
    "sources": [
      "https://consensys.net//diligence/audits/2021/04/rocketpool/"
    ],
    "notes": "Critical finding imported as metadata; review original source before promotion.",
    "case_id": "SCF-0010"
  },
  {
    "title": "RocketDAOProtocolSettings/RocketDAONodeTrustedSettings - anyone can set/overwrite settings until contract is declared \"deployed\"",
    "severity": "Critical",
    "record_type": "audit_finding",
    "status": "candidate",
    "source_name": "Smart Contract VulnDB",
    "project": "/diligence/audits/2021/04/rocketpool/",
    "vulnerability_class": null,
    "impact": null,
    "cvss": null,
    "reward_amount": null,
    "reward_currency": null,
    "disclosed": null,
    "evidence_level": "secondary",
    "sources": [
      "https://consensys.net//diligence/audits/2021/04/rocketpool/"
    ],
    "notes": "Critical finding imported as metadata; review original source before promotion.",
    "case_id": "SCF-0011"
  },
  {
    "title": "RocketStorage - anyone can set/update values before the contract is initialized",
    "severity": "Critical",
    "record_type": "audit_finding",
    "status": "candidate",
    "source_name": "Smart Contract VulnDB",
    "project": "/diligence/audits/2021/04/rocketpool/",
    "vulnerability_class": null,
    "impact": null,
    "cvss": null,
    "reward_amount": null,
    "reward_currency": null,
    "disclosed": null,
    "evidence_level": "secondary",
    "sources": [
      "https://consensys.net//diligence/audits/2021/04/rocketpool/"
    ],
    "notes": "Critical finding imported as metadata; review original source before promotion.",
    "case_id": "SCF-0012"
  },
  {
    "title": "Winning pods can be frontrun with large deposits",
    "severity": "Critical",
    "record_type": "audit_finding",
    "status": "candidate",
    "source_name": "Smart Contract VulnDB",
    "project": "/diligence/audits/2021/03/pooltogether-pods/",
    "vulnerability_class": null,
    "impact": null,
    "cvss": null,
    "reward_amount": null,
    "reward_currency": null,
    "disclosed": null,
    "evidence_level": "secondary",
    "sources": [
      "https://consensys.net//diligence/audits/2021/03/pooltogether-pods/"
    ],
    "notes": "Critical finding imported as metadata; review original source before promotion.",
    "case_id": "SCF-0013"
  },
  {
    "title": "Token transfers may return `false`",
    "severity": "Critical",
    "record_type": "audit_finding",
    "status": "candidate",
    "source_name": "Smart Contract VulnDB",
    "project": "/diligence/audits/2021/03/pooltogether-pods/",
    "vulnerability_class": null,
    "impact": null,
    "cvss": null,
    "reward_amount": null,
    "reward_currency": null,
    "disclosed": null,
    "evidence_level": "secondary",
    "sources": [
      "https://consensys.net//diligence/audits/2021/03/pooltogether-pods/"
    ],
    "notes": "Critical finding imported as metadata; review original source before promotion.",
    "case_id": "SCF-0014"
  },
  {
    "title": "`TokenDrop`: Unprotected `initialize()` function",
    "severity": "Critical",
    "record_type": "audit_finding",
    "status": "candidate",